"","Year","Title","Journal","QScimago","IF2010","IF2011","IF2012","IF2013","IF2014","IF2015","IF2016","IF2017","IF2018","IF2019","IF2020","IF2021","IF2022","Impact.Factor","IF"
"1",2023,"A review on 3D printing of bioinspired hydrophobic materials: oil-water separation\, water harvesting\, and diverse applications","advanced composites and hybrid materials","Q1",NA,NA,NA,NA,NA,NA,NA,NA,NA,NA,NA,NA,NA,NA,"No FI"
"2",2023,"Evaluation and Validation Process of Extended Reality Applications Developed in an Industrial Context: A Systematic Review","sn computer science","Q2",NA,NA,NA,NA,NA,NA,NA,NA,NA,NA,NA,NA,NA,NA,"No FI"
"3",2023,"Enhancing vibration damping properties of additively manufactured viscoelastic structures through process parameter optimization","mechanics of advanced materials and structures","Q2",0.734,0.926,0.701,0.664,0.773,1,1.196,2.645,2.873,3.517,4.03,3.338,2.8,2.8,"Avec FI"
"4",2023,"Identifying blocking behaviors in small‐scale group decision‐making and their impact on consensus outcomes: A case study on forest management","journal of multi-criteria decision analysis","Q2",NA,NA,NA,NA,NA,NA,NA,NA,NA,NA,NA,NA,NA,NA,"No FI"
"5",2023,"Life cycle assessment of filament production in distributed plastic recycling via additive manufacturing","cleaner waste systems",NA,NA,NA,NA,NA,NA,NA,NA,NA,NA,NA,NA,NA,NA,NA,"No FI"
"6",2023,"An approach to guide the search for potentially hazardous scenarios for autonomous vehicle safety validation","applied sciences","Q2",NA,NA,NA,NA,NA,NA,NA,NA,NA,NA,NA,NA,NA,NA,"No FI"
"7",2023,"Open source IoT-based collection bin applied to local plastic recycling","hardwarex","Q2",NA,NA,NA,NA,NA,NA,NA,NA,NA,NA,NA,NA,NA,NA,"No FI"
"8",2023,"“Do-It-Together” and Innovation: Transforming European Industry","journal of innovation economics & management",NA,NA,NA,NA,NA,NA,NA,NA,NA,NA,NA,NA,NA,NA,NA,"No FI"
"9",2023,"Implementing Do-It-Together: The Cross-fertilization of Do-It-Yourself and Open Manufacturing,Mise en œuvre du Do-It-Together : le croisement du Do-It-Yourself et de la fabrication ouverte","journal of innovation economics & management",NA,NA,NA,NA,NA,NA,NA,NA,NA,NA,NA,NA,NA,NA,NA,"No FI"
"10",2023,"Mariana Mazzucato (2021)\, Mission Economy: A Moonshot Guide to Changing Capitalism\, Allen Lane\, London\, 272 p.","journal of innovation economics & management",NA,NA,NA,NA,NA,NA,NA,NA,NA,NA,NA,NA,NA,NA,NA,"No FI"
"11",2023,"Territorial dynamics supported by a collaborative network of innovation labs: toward an approach to establish a portfolio of indicators to monitor and assess their territorial impact","international journal of innovation and technology management","Q3",NA,NA,NA,NA,NA,NA,NA,NA,NA,NA,NA,NA,NA,NA,"No FI"
"12",2023,"An ontology for the design of emulsion-based cosmetic products: Development and applications,Une ontologie pour la conception de produits cosmétiques à base d'émulsion : Développement et applications","computers & chemical engineering",NA,2.072,2.32,2.091,2.452,2.784,2.581,3.024,3.113,3.334,4,3.845,4.13,4.3,4.3,"Avec FI"
"13",2023,"Towards a Knowledge Base to Support the Management of the Design Process of Formulated Products","processes","Q2",NA,NA,NA,NA,NA,NA,NA,1.279,1.963,2.753,2.847,3.352,3.5,3.5,"Avec FI"
"14",2023,"Towards a Modeling of the Impacts of Road Verge Management on the Pollination Service Using System Dynamics: A Case Study in France,Vers une modélisation des impacts de la gestion des accotements routiers sur le service de pollinisation à l'aide de la dynamique des systèmes : Une étude de cas en France","applied mathematics","Q4",NA,NA,NA,NA,NA,NA,NA,NA,NA,NA,NA,NA,NA,NA,"No FI"
"15",2022,"Analytical modeling of deposited filaments for high viscosity material-based piston-driven direct ink writing","international journal of advanced manufacturing technology","Q1",1.071,1.103,1.205,1.779,1.458,1.568,2.209,2.601,2.496,2.633,3.226,3.563,3.4,3.4,"Avec FI"
"16",2022,"Numerical simulation and experimental validation of deposited corners of any angle in direct ink writing","international journal of advanced manufacturing technology","Q1",1.071,1.103,1.205,1.779,1.458,1.568,2.209,2.601,2.496,2.633,3.226,3.563,3.4,3.4,"Avec FI"
"17",2022,"Qualitative sustainability assessment of road verge management in France: An approach from causal diagrams to seize the importance of impact pathways","environmental impact assessment review","Q1",1.944,2.596,1.851,2.046,2.4,2.922,3.094,3.054,3.749,4.135,4.549,6.122,7.9,7.9,"Avec FI"
"18",2022,"Chaotic Honeybees Optimization Algorithms Approach for Traveling Salesperson Problem","complexity","Q2",1.367,1.02,1.333,1.029,1.041,3.514,4.621,1.829,2.591,2.462,2.833,2.121,2.3,2.3,"Avec FI"
"19",2022,"Feasibility study on the use of recycled materials for prototyping purposes: A comparative study based on the tensile strength","proceedings of the institution of mechanical engineers, part b: journal of engineering manufacture","Q2",NA,NA,NA,NA,NA,NA,NA,NA,NA,NA,NA,NA,NA,NA,"No FI"
"20",2022,"Embedding non-industrial private forest owners in forest policy and bioeconomy issues using a Living Lab concept","forest policy and economics","Q1",0.895,1.482,1.638,1.81,1.856,1.552,1.982,2.496,3.099,3.139,3.673,4.259,4,4,"Avec FI"
"21",2022,"Relationship between innovation and exports in enterprises: A support tool for synergistic improvement plans","technological forecasting and social change","Q1",2.034,1.709,2.106,1.959,2.058,2.678,2.625,3.131,3.815,5.846,8.593,10.884,12,12,"Avec FI"
"22",2022,"Modeling and evaluation of freeform extruded filament based on numerical simulation method for direct ink writing","international journal of advanced manufacturing technology","Q1",1.071,1.103,1.205,1.779,1.458,1.568,2.209,2.601,2.496,2.633,3.226,3.563,3.4,3.4,"Avec FI"
"23",2022,"Non-linear vibration analysis of visco-elastically damped composite structures by multilevel finite elements and asymptotic numerical method","composites part c: open access","Q1",NA,NA,NA,NA,NA,NA,NA,NA,NA,NA,NA,NA,NA,NA,"No FI"
"24",2022,"Approche systémique de l’évaluation des impacts d’une innovation : application à la mise en place d’un infirmier de liaison au Centre Hospitalier de Luxembourg","projectics / proyéctica / projectique",NA,NA,NA,NA,NA,NA,NA,NA,NA,NA,NA,NA,NA,NA,NA,"No FI"
"25",2022,"Innovative Process for Furniture Design: Contributions of 3D Scan and Virtual Reality","computer-aided design and applications","Q3",NA,NA,NA,NA,NA,NA,NA,NA,NA,NA,NA,NA,NA,NA,"No FI"
"26",2022,"General Methodology to Investigate the Effect of Process Parameters on the Vibration Properties of Structures Produced by Additive Manufacturing Using Fused Filament Fabrication","jom journal of the minerals, metals and materials society",NA,NA,NA,NA,NA,NA,NA,NA,NA,NA,NA,NA,NA,NA,NA,"No FI"
"27",2022,"Triggers for chemical product design: A systematic literature review","aiche journal","Q1",2.03,2.261,2.493,2.581,2.748,2.98,2.836,3.326,3.463,3.519,3.993,4.167,3.7,3.7,"Avec FI"
"28",2022,"Analyzing responsible innovation: an illustrative application to the case of the Research Network on Innovation,Analyse de l’innovation responsable : une application illustrative au cas du Réseau de Recherche sur l’Innovation","technologie et innovation",NA,NA,NA,NA,NA,NA,NA,NA,NA,NA,NA,NA,NA,NA,NA,"No FI"
"29",2022,"DEEP\, a methodology for entity extraction using organizational patterns: application to job offers","knowledge-based systems","Q1",1.574,2.422,4.104,3.058,2.947,3.325,4.529,4.396,5.101,5.921,8.038,8.139,8.8,8.8,"Avec FI"
"30",2022,"Towards an improved acceptability assessment model of innovative solutions in the design phase","international journal of business information systems","Q2",NA,NA,NA,NA,NA,NA,NA,NA,NA,NA,NA,NA,NA,NA,"No FI"
"31",2022,"Social\, political\, and technological dimensions of the sustainability evaluation of a recycling network. A literature review","cleaner engineering and technology","Q1",NA,NA,NA,NA,NA,NA,NA,NA,NA,NA,NA,NA,NA,NA,"No FI"
"32",2022,"Innovation Spaces as Drivers of Eco-innovations Supporting the Circular Economy: A Systematic Literature Review","journal of innovation economics & management",NA,NA,NA,NA,NA,NA,NA,NA,NA,NA,NA,NA,NA,NA,NA,"No FI"
"33",2022,"Evaluation of tech ventures' evolving business models: rules for performance-related classification","international journal of entrepreneurial venturing","Q3",NA,NA,NA,NA,NA,NA,NA,NA,NA,NA,NA,NA,NA,NA,"No FI"
"34",2022,"Agile supply chain analytic approach: a case study combining agile and CRISP-DM in an end-to-end supply chain","supply chain forum: an international journal",NA,NA,NA,NA,NA,NA,NA,NA,NA,NA,NA,NA,NA,NA,NA,"No FI"
"35",2021,"Toward a holistic understanding of performance in Lean Manufacturing: a discussion on the relevance of its indicators","international journal of lean six sigma","Q1",NA,NA,NA,NA,NA,NA,NA,NA,NA,2.511,3.329,5.686,4,5.686,"Avec FI"
"36",2021,"Innovation Capacity of City Administrations: A Best Practices Approach","journal of innovation economics & management",NA,NA,NA,NA,NA,NA,NA,NA,NA,NA,NA,NA,NA,NA,NA,"No FI"
"37",2021,"Vehicle Routing Problem with Deadline and Stochastic Service Times: Case of the Ice Cream Industry in Santiago City of Chile","mathematics","Q2",NA,NA,NA,NA,NA,NA,NA,NA,1.105,1.747,2.258,2.592,2.4,2.592,"Avec FI"
"38",2021,"Chemical product design integrating MCDA : Performance prediction and human preferences modelling","the canadian journal of chemical engineering",NA,NA,NA,NA,NA,NA,NA,NA,NA,NA,NA,NA,NA,NA,NA,"No FI"
"39",2021,"A multi-stakeholder system-based methodology to evaluate the needs of innovation ecosystems","research in engineering design",NA,1.25,1.243,1.562,1.944,1.233,1.786,2.297,2.625,2,2.224,2.655,2.964,3.2,2.964,"Avec FI"
"40",2021,"Developing the persona method to increase the commitment of non-industrial private forest owners in French forest policy priorities","forest policy and economics","Q1",0.895,1.482,1.638,1.81,1.856,1.552,1.982,2.496,3.099,3.139,3.673,4.259,4,4.259,"Avec FI"
"41",2021,"Sustainability analysis for the design of distributed energy systems: A multi-objective optimization approach","applied energy","Q1",3.915,5.106,4.781,5.261,5.613,5.746,7.182,7.9,8.426,8.848,9.746,11.446,11.2,11.446,"Avec FI"
"42",2021,"Methodology for Emulsion Design Based on Emulsion Science and Expert Knowledge. Part 2: An Application in the Cosmetics Sector","industrial and engineering chemistry research",NA,NA,NA,NA,NA,NA,NA,NA,NA,NA,NA,NA,NA,NA,NA,"No FI"
"43",2021,"Design of Formulated Products Integrating Heuristic Knowledge and Consumer Assessment","aiche journal","Q1",2.03,2.261,2.493,2.581,2.748,2.98,2.836,3.326,3.463,3.519,3.993,4.167,3.7,4.167,"Avec FI"
"44",2021,"A new methodology to support smartness at the district level of metropolitan areas in emerging economies: The case of Santiago de Chile","sustainable cities and society","Q1",NA,NA,NA,NA,NA,1.044,1.777,3.073,4.624,5.268,7.587,10.696,11.7,10.696,"Avec FI"
"45",2021,"Optimizing Process Parameters of Direct Ink Writing for Dimensional Accuracy of Printed Layers","3d printing and additive manufacturing","Q1",NA,NA,NA,NA,NA,NA,3.389,2.304,3.259,3.579,5.449,5.355,3.1,5.355,"Avec FI"
"46",2021,"Multi-criteria Optimization for the Design and Operation of Distributed Energy Systems Considering Sustainability Dimensions","energy","Q1",3.597,3.487,3.651,4.159,4.844,4.292,4.52,4.968,5.537,6.082,7.147,8.857,9,8.857,"Avec FI"
"47",2021,"Analyse et évaluation du développement territorial durable","marché et organisations",NA,NA,NA,NA,NA,NA,NA,NA,NA,NA,NA,NA,NA,NA,NA,"No FI"
"48",2021,"A Methodology for Emulsion Design Based on Emulsion Science and Expert Knowledge. Part 1: Conceptual Approach","industrial and engineering chemistry research",NA,NA,NA,NA,NA,NA,NA,NA,NA,NA,NA,NA,NA,NA,NA,"No FI"
"49",2021,"Open-Source Script for Design and 3D Printing of Porous Structures for Soil Science","technologies",NA,NA,NA,NA,NA,NA,NA,NA,NA,NA,NA,NA,NA,NA,NA,"No FI"
"50",2020,"3D printing: An emerging opportunity for soil science","geoderma","Q1",2.178,2.318,2.345,2.509,2.772,2.855,4.036,3.74,4.336,4.848,6.114,7.422,6.1,6.114,"Avec FI"
"51",2020,"Conversion of self-contained breathing apparatus mask to open source powered air-purifying particulate respirator for fire fighter COVID-19 response","hardwarex","Q2",NA,NA,NA,NA,NA,NA,NA,NA,NA,NA,NA,NA,NA,NA,"No FI"
"52",2020,"Partially RepRapable automated open source bag valve mask-based ventilator","hardwarex","Q2",NA,NA,NA,NA,NA,NA,NA,NA,NA,NA,NA,NA,NA,NA,"No FI"
"53",2020,"Parametric nasopharyngeal swab for sampling COVID-19 and other respiratory viruses: Open source design\, SLA 3-D printing and UV curing system","hardwarex","Q2",NA,NA,NA,NA,NA,NA,NA,NA,NA,NA,NA,NA,NA,NA,"No FI"
"54",2020,"Open source high-temperature RepRap for 3-D printing heat-sterilizable PPE and other applications","hardwarex","Q2",NA,NA,NA,NA,NA,NA,NA,NA,NA,NA,NA,NA,NA,NA,"No FI"
"55",2020,"Evaluating Innovation and Export Capabilities of SMEs: Toward a Multi-Criteria Decision-Making Methodology","journal of technology management and innovation","Q3",NA,NA,NA,NA,NA,NA,NA,NA,NA,NA,NA,NA,NA,NA,"No FI"
"56",2020,"Plastic recycling in additive manufacturing: a systematic literature review and opportunities for the circular economy","journal of cleaner production","Q1",2.43,2.727,3.398,3.59,3.844,4.959,5.715,5.651,6.395,7.246,9.297,11.072,11.1,9.297,"Avec FI"
"57",2020,"An Approach Based on Bayesian Network for Improving Project Management Maturity: An Application to Reduce Cost Overrun Risks in Engineering Projects","computers in industry","Q1",1.62,1.529,1.709,1.457,1.287,1.685,2.691,2.85,4.769,3.954,7.635,11.245,10,7.635,"Avec FI"
"58",2020,"Analysis and Improvement of an Innovative Solution Through Risk Reduction: Application to Home Care for the Elderly","advances in science, technology and engineering systems journal",NA,NA,NA,NA,NA,NA,NA,NA,NA,NA,NA,NA,NA,NA,NA,"No FI"
"59",2020,"Digitalization and SMEs’ Export Management: Impacts on Resources and Capabilities","technology innovation management review","Q2",NA,NA,NA,NA,NA,NA,NA,NA,NA,NA,NA,NA,NA,NA,"No FI"
"60",2020,"How do Institutions Promote Digital Marketing in Small and Medium International Companies: Comparison between Costa Rica and France","technology innovation management review","Q2",NA,NA,NA,NA,NA,NA,NA,NA,NA,NA,NA,NA,NA,NA,"No FI"
"61",2020,"Mechanical Properties of Direct Waste Printing of Polylactic Acid with Universal Pellets Extruder: Comparison to Fused Filament Fabrication on Open-Source Desktop Three-Dimensional Printers","3d printing and additive manufacturing","Q1",NA,NA,NA,NA,NA,NA,3.389,2.304,3.259,3.579,5.449,5.355,3.1,5.449,"Avec FI"
"62",2020,"Closed loop supply chain network for local and distributed plastic recycling for 3D printing: a MILP-based optimization approach","resources conservation and recycling","Q1",1.974,1.759,2.319,2.692,2.564,3.28,3.313,5.12,7.044,8.086,10.204,13.716,13.2,10.204,"Avec FI"
"63",2020,"Challenges and trends in the valuation of ecosystem services in agro-ecosystems: a systematic revision","tropical and subtropical agroecosystems","Q3",NA,NA,NA,NA,NA,NA,NA,NA,NA,NA,NA,NA,NA,NA,"No FI"
"64",2020,"Industrial Symbiosis and Territorial Development: The Cross-Fertilization of Proximity Dynamics and the Role of Information and Knowledge Flows","journal of the knowledge economy","Q2",NA,NA,NA,NA,NA,NA,NA,NA,NA,NA,NA,NA,NA,NA,"No FI"
"65",2020,"Collaborative spaces promoting creativity and innovation","journal of innovation economics & management",NA,NA,NA,NA,NA,NA,NA,NA,NA,NA,NA,NA,NA,NA,NA,"No FI"
"66",2020,"Espaces et nouvelles formes d’organisation du travail créatif","innovations - revue d’économie et de management de l'innovation",NA,NA,NA,NA,NA,NA,NA,NA,NA,NA,NA,NA,NA,NA,NA,"No FI"
"67",2020,"Sustainable risk management strategy selection using a fuzzy multi-criteria decision approach","international journal of disaster risk reduction","Q1",NA,NA,NA,NA,NA,1.242,1.603,1.968,2.568,2.896,4.32,4.842,5,4.32,"Avec FI"
"68",2020,"Towards smart and suitable management of roadsides: System dynamics in the era of industry 4.0","sustainable operations and computers",NA,NA,NA,NA,NA,NA,NA,NA,NA,NA,NA,NA,NA,NA,NA,"No FI"
"69",2020,"A review of open source ventilators for COVID-19 and future pandemics","f1000research","Q1",NA,NA,NA,NA,NA,NA,NA,NA,NA,NA,NA,NA,NA,NA,"No FI"
"70",2020,"Characterization of Best Practices for Customer/Supplier Collaboration in Co-innovation Projects","journal of technology management and innovation","Q3",NA,NA,NA,NA,NA,NA,NA,NA,NA,NA,NA,NA,NA,NA,"No FI"
"71",2020,"Perspectives d'émergence d'une filière forêt-chimie des extractibles Points de vue des acteurs du Nord-Est de la France et du Sud-Ouest de l'Allemagne,Perspektiven zur Entstehung einer neuen Wertschöpfungskette Wald – Chemie der Holzinhalts-stoffe. Standpunkte der Akteure in Nordost-Frankreich und Südwest-Deutschland,Prospects for the Emergence of a Forests/Extractive Chemicals industry. Points of View of Players in North-eastern France and South-West Germany","revue forestière française",NA,NA,NA,NA,NA,NA,NA,NA,NA,NA,NA,NA,NA,NA,NA,"No FI"
"72",2020,"Shaping a Public Innovation Laboratory in Bogota: Learning through Time\, Space and Stakeholders","journal of innovation economics & management",NA,NA,NA,NA,NA,NA,NA,NA,NA,NA,NA,NA,NA,NA,NA,"No FI"
"73",2020,"Innovation et agilité - identification de stratégies de déploiement pour le développement des PME","projectics / proyéctica / projectique",NA,NA,NA,NA,NA,NA,NA,NA,NA,NA,NA,NA,NA,NA,NA,"No FI"
"74",2019,"Review of the AFIS 2018 Academy-Industry meetings in Nancy -The celebration of the 20th anniversary of AFIS!","insight - international council on systems engineering (incose)",NA,NA,NA,NA,NA,NA,NA,NA,NA,NA,NA,NA,NA,NA,NA,"No FI"
"75",2019,"Challenges for autonomous vehicles (AVs) engineering: Safety validation of functional performance limitations","insight - international council on systems engineering (incose)",NA,NA,NA,NA,NA,NA,NA,NA,NA,NA,NA,NA,NA,NA,NA,"No FI"
"76",2019,"Editorial - Special issue on System of Systems Engineering","systems engineering","Q2",0.791,0.42,0.656,0.923,0.7,0.956,0.5,0.797,0.848,1,1.449,2.034,2,1,"Avec FI"
"77",2019,"Interface modeling for product‐service system integration","systems engineering","Q2",0.791,0.42,0.656,0.923,0.7,0.956,0.5,0.797,0.848,1,1.449,2.034,2,1,"Avec FI"
"78",2019,"Application of Decision-Making Methods in Smart City Projects","smart cities","Q1",NA,NA,NA,NA,NA,NA,NA,NA,NA,NA,NA,NA,NA,NA,"No FI"
"79",2019,"A green procurement methodology based on Kraljic Matrix for supplier`s evaluation and selection: a case study from the chemical sector","supply chain forum: an international journal",NA,NA,NA,NA,NA,NA,NA,NA,NA,NA,NA,NA,NA,NA,NA,"No FI"
"80",2019,"Evaluating air quality by combining stationary\, smart mobile pollution monitoring and data-driven modelling","journal of cleaner production","Q1",2.43,2.727,3.398,3.59,3.844,4.959,5.715,5.651,6.395,7.246,9.297,11.072,11.1,7.246,"Avec FI"
"81",2019,"Understanding user representations\, a new development path for supporting Smart City policy: Evaluation of the electric car use in Lorraine Region","technological forecasting and social change","Q1",2.034,1.709,2.106,1.959,2.058,2.678,2.625,3.131,3.815,5.846,8.593,10.884,12,5.846,"Avec FI"
"82",2019,"Methodology to design ontologies from organizational models: application to creativity workshops","ai edam",NA,NA,NA,NA,NA,NA,NA,NA,NA,NA,NA,NA,NA,NA,NA,"No FI"
"83",2019,"A Step for improving the transition between traditional Project Management to Agile Project Management","the journal of modern project management",NA,NA,NA,NA,NA,NA,NA,NA,NA,NA,NA,NA,NA,NA,NA,"No FI"
"84",2019,"Multiobjective optimization for the design of phase III biorefinery sustainable supply chain","journal of cleaner production","Q1",2.43,2.727,3.398,3.59,3.844,4.959,5.715,5.651,6.395,7.246,9.297,11.072,11.1,7.246,"Avec FI"
"85",2019,"Are High-Tech Companies More Competitive Than Others? An Empirical Study of Innovative and Exporting French SMEs","technology innovation management review","Q2",NA,NA,NA,NA,NA,NA,NA,NA,NA,NA,NA,NA,NA,NA,"No FI"
"86",2019,"Design and management of innovation laboratories: Toward a performance assessment tool","creativity and innovation management","Q1",NA,NA,0.855,0.714,1.016,1.143,1.423,1.553,2.015,2.113,3.051,3.644,3.5,2.113,"Avec FI"
"87",2019,"Confiance et Technologie,Confidence and Technology","technologie et innovation",NA,NA,NA,NA,NA,NA,NA,NA,NA,NA,NA,NA,NA,NA,NA,"No FI"
"88",2019,"Agile innovation: Creating value in uncertain environments","journal of innovation economics & management",NA,NA,NA,NA,NA,NA,NA,NA,NA,NA,NA,NA,NA,NA,NA,"No FI"
"89",2019,"Process and resource selection methodology in design for additive manufacturing","international journal of advanced manufacturing technology","Q1",1.071,1.103,1.205,1.779,1.458,1.568,2.209,2.601,2.496,2.633,3.226,3.563,3.4,2.633,"Avec FI"
"90",2019,"Communautés et agilité : la complexité de l’organisation innovante,Knowledge communities and creative agility","innovations - revue d’économie et de management de l'innovation",NA,NA,NA,NA,NA,NA,NA,NA,NA,NA,NA,NA,NA,NA,NA,"No FI"
"91",2019,"Agilité et conception de filière : le cas de la montre SWATCH","technologie et innovation",NA,NA,NA,NA,NA,NA,NA,NA,NA,NA,NA,NA,NA,NA,NA,"No FI"
"92",2019,"Innovation Agile : Regards Pluridisciplinaires,Agile Innovation: Multidisciplinary Approaches","technologie et innovation",NA,NA,NA,NA,NA,NA,NA,NA,NA,NA,NA,NA,NA,NA,NA,"No FI"
"93",2019,"Innovation Spaces in Universities: Support for Collaborative Learning","journal of innovation economics & management",NA,NA,NA,NA,NA,NA,NA,NA,NA,NA,NA,NA,NA,NA,NA,"No FI"
"94",2019,"Le caractère dynamique et évolutif de la notion d’innovation : Quelles conséquences pour l’évaluation de la capacité à innover des entreprises ?","technologie et innovation",NA,NA,NA,NA,NA,NA,NA,NA,NA,NA,NA,NA,NA,NA,NA,"No FI"
"95",2019,"Living lab as a support to trust for co-creation of value: application to the consumer energy market","journal of innovation economics & management",NA,NA,NA,NA,NA,NA,NA,NA,NA,NA,NA,NA,NA,NA,NA,"No FI"
"96",2019,"Agility and product supply chain design: The case of the Swatch","journal of innovation economics & management",NA,NA,NA,NA,NA,NA,NA,NA,NA,NA,NA,NA,NA,NA,NA,"No FI"
"97",2018,"A new framework to support Lean Six Sigma deployment in SMEs","international journal of lean six sigma","Q1",NA,NA,NA,NA,NA,NA,NA,NA,NA,2.511,3.329,5.686,4,NA,"No FI"
"98",2018,"Numerical method for nonlinear complex eigenvalues problems depending on two parameters: Application to three-layered viscoelastic composite structures","mechanics of advanced materials and structures","Q2",0.734,0.926,0.701,0.664,0.773,1,1.196,2.645,2.873,3.517,4.03,3.338,2.8,2.873,"Avec FI"
"99",2018,"A system dynamics approach for sustainability assessment of biodiesel production in Colombia. Baseline simulation","journal of cleaner production","Q1",2.43,2.727,3.398,3.59,3.844,4.959,5.715,5.651,6.395,7.246,9.297,11.072,11.1,6.395,"Avec FI"
"100",2018,"Trends in design of distributed energy systems using hydrogen as energy vector: A systematic literature review","international journal of hydrogen energy","Q1",4.057,4.054,3.548,2.93,3.313,3.205,3.582,4.229,4.084,4.939,5.816,7.139,7.2,4.084,"Avec FI"
"101",2018,"Multi-objective traffic signal optimization using 3D mesoscopic simulation and evolutionary algorithms","simulation modelling practice and theory","Q1",0.736,0.969,1.159,1.05,1.383,1.482,1.954,2.092,2.426,2.219,3.272,4.199,4.2,2.426,"Avec FI"
"102",2018,"Incorporation of Heuristic Knowledge in the Optimal Design of Formulated Products: Application to a Cosmetic Emulsion","computers & chemical engineering",NA,2.072,2.32,2.091,2.452,2.784,2.581,3.024,3.113,3.334,4,3.845,4.13,4.3,3.334,"Avec FI"
"103",2018,"Une approche de conception de systèmes multi-agents dédiés à la gestion des connaissances","revue des sciences et technologies de l'information - série isi : ingénierie des systèmes d'information",NA,NA,NA,NA,NA,NA,NA,NA,NA,NA,NA,NA,NA,NA,NA,"No FI"
"104",2018,"Firm Readiness Level for Innovation Projects: A New Decision-Making Tool for Innovation Managers","international review of administrative sciences","Q1",0.848,0.783,0.559,0.765,0.658,0.716,1.35,1.988,2.174,2.129,3.094,2.397,2.3,2.174,"Avec FI"
"105",2018,"Contribution to the objective assessment of technical skills for surgery students: An accelerometer based approach","international journal of industrial ergonomics","Q2",1.322,1.26,1.208,1.214,1.07,1,1.415,1.429,1.571,1.662,2.656,2.884,3.1,1.571,"Avec FI"
"106",2018,"L’indice d’innovation potentielle (IIP) : un diagnostic de la capacité à innover au service des PME","revue internationale pme",NA,NA,NA,NA,NA,NA,NA,NA,NA,NA,NA,NA,NA,NA,NA,"No FI"
"107",2018,"Vers une meilleure compréhension du concept de design,Towards a Better Understanding of the Concept of Design,Hacia una mejor comprensión del concepto de diseño","projectics / proyéctica / projectique",NA,NA,NA,NA,NA,NA,NA,NA,NA,NA,NA,NA,NA,NA,NA,"No FI"
"108",2018,"Predicting Air Quality by Integrating a Mesoscopic Traffic Simulation Model and Simplified Air Pollutant Estimation Models","international journal of intelligent transportation systems research","Q2",NA,NA,NA,NA,NA,NA,NA,NA,NA,NA,NA,NA,NA,NA,"No FI"
"109",2017,"Modeling and optimization of a photocatalytic process: Degradation of endocrine disruptor compounds by Ag/ZnO","chemical engineering research & design","Q2",1.519,1.968,1.927,2.281,2.348,2.525,2.538,2.795,3.073,3.35,3.739,4.119,3.9,2.795,"Avec FI"
"110",2017,"The first ROBAFIS-ROBSE international student competition in Systems Engineering","insight - international council on systems engineering (incose)",NA,NA,NA,NA,NA,NA,NA,NA,NA,NA,NA,NA,NA,NA,NA,"No FI"
