Url;Title;Authors;Type.document;DOI;Year;Journal;Publisher;Conference;Language
https://hal.univ-lorraine.fr/hal-01736667;“Empowering everyone to innovate”\, Sharing vision(s) and practices of how to achieve it through collaboratories.;Brigitte Trousse,Arthur Serra,Virginie Zingraff,Laurent Dupont;COMM;;2016;;;Open Living Labs Days;en
https://hal.archives-ouvertes.fr/hal-01321071;Operational and system hazard analysis in a safe systems requirement engineering process – Application to automotive industry;Pierre Mauborgne,Samuel Deniaud,Eric Levrat,Eric Bonjour,Jean-Pierre Micaëlli,Dominique Loise;ART;10.1016/j.ssci.2016.04.011;2016;Safety Science;Elsevier;;en
https://hal.univ-lorraine.fr/hal-01522504;Sensitivity analysis of the damping properties of viscoelastic composite structures according to the layers thicknesses;Komlan Akoussan,Hakim Boudaoud,El Mostafa Daya,Yao Koutsawa,Erasmo Carrera;ART;10.1016/j.compstruct.2016.03.061;2016;Composite Structures;Elsevier;;en
https://hal.univ-lorraine.fr/hal-01523218;New product acceptability evaluation and improvement model with knowledge reuse**This work is financed by a grant from the French Ministry of Higher Education and Research (Ministere de l’Enseignement superieur et de 1a Recherche\, MESR).;Giovanny Arbelaez Garces,Eric Bonjour,Auguste Rakotondranaivo;COMM;10.1016/j.ifacol.2016.07.639;2016;;;8th IFAC Conference on Manufacturing Modeling, Management & Control;en
https://hal.univ-lorraine.fr/hal-01736671;L’innovation numérique\, facteur de développement des territoires ruraux;Laurent Dupont;COMM;;2016;;;Défis numériques des territoires ruraux. Infrastructures et usages. Regards croisés en Grande Région;fr
https://hal.univ-lorraine.fr/hal-02083876;Understanding Museum visitors' experience through an Eye-tracking study and a Living Lab approach;Paola Patricia Parra Morantes,Sonia Andrea Peñarete,Giovanny Arbelaez Garces,Mauricio Camargo,Laurent Dupont;COMM;10.1109/ICE/ITMC39735.2016.9025900;2016;;;22nd ICE/IEEE International Technology Management Conference;en
https://hal.archives-ouvertes.fr/hal-02510621;Use as essential factor for Technology Adoption: Case study of electric vehicle’s uses in French regional Ecosystem;Julien Hubert,Laurent Dupont,Claudine Guidat;COMM;10.1109/ICE/ITMC39735.2016.9026122;2016;;;2016 International Conference on Engineering, Technology and Innovation/IEEE lnternational Technology Management Conference (ICE/ITMC};en
https://hal.archives-ouvertes.fr/hal-01331887;Exploring the Appropriateness of Different Immersive Environments in the Context of an Innovation Process for Smart Cities;Laurent Dupont,Laure Morel,Marc Pallot;COMM;10.1109/ICE/ITMC39735.2016.9025965;2016;;;22nd ICE/IEEE International Technology Management Conference;en
https://hal.univ-lorraine.fr/hal-02918803;Dealing with acceptability of innovative solutions for active travels in urban environment : Proposition of a sensory-emotional approach as a cornerstone of user experience design;Aline Convolte,Frédérique Mayer,Claudine Guidat,Vuillemin Anne;COMM;10.1109/ICE/ITMC39735.2016.9026153;2016;;;2016 International Conference on Engineering, Technology and Innovation/IEEE lnternational Technology Management Conference (ICE/ITMC};en
https://hal.archives-ouvertes.fr/hal-01891266;Observing innovation impacts on supply chain: the case of the Swatch;Brunelle Marche,Vincent Boly,J. Ortt;COMM;;2016;;;International Conference on Engineering, Technology & Innovation;en
https://hal.univ-lorraine.fr/hal-01736701;A la une : Nancy Grand Cœur se distingue par son approche de la mobilité;Malika Dati,Frédéric Chastanier,Laurent Dupont;OTHER;;2016;Transflash;Cerema;;fr
https://hal.univ-lorraine.fr/tel-01752264;Intégration des préférences des parties prenantes et amélioration de l'acceptabilité lors du processus de co-conception : application au système de santé,Integration of stakeholders' preferences in the co-design process: application in the healthcare system;Giovanny Alberto Arbelaez Garces;THESE;;2016;;;;fr
https://hal.archives-ouvertes.fr/hal-01448844;A categorization of customer concerns for an OT front-end of innovation process in an IT/OT convergence context;Emilie Bonnetto,Bernard Yannou,Gwenola Bertoluci,Vincent Boly,Jorge Alvarez;COMM;;2016;;;International Design Conference;en
https://hal.archives-ouvertes.fr/hal-02492178;SMEs’ Innovation and Export Capabilities: Toward a common Conceptual Framework;Manon Enjolras,Mauricio Camargo,Christophe Schmitt;COMM;;2016;;;IAMOT 2016. Conference Proceedings of the 25th International Conference on Management of Technology;en
https://tel.archives-ouvertes.fr/tel-01497964;Vers une ingénierie de systèmes sûrs de fonctionnement basée sur les modèles en conception innovante,Towards a Safe Systems Engineering;Pierre Mauborgne;THESE;;2016;;;;fr
https://hal.univ-lorraine.fr/hal-01522502;An acceptability estimation and analysis methodology based on Bayesian networks;Giovanny Arbelaez Garces,Auguste Rakotondranaivo,Eric Bonjour;ART;10.1016/j.ergon.2016.02.005;2016;International Journal of Industrial Ergonomics;Elsevier;;en
https://hal.archives-ouvertes.fr/hal-01891016;OBSERVING NEW PRODUCT IMPACTS ON SECTORS VALUE CHAINS: THE CASE OF A FRENCH ELECTRONIC SME;Brunelle Marche,Vincent Boly,Roland Ortt;COMM;;2016;;;IAMOT;en
https://hal.archives-ouvertes.fr/hal-02378279;De l’expérience aux compétences en langues : le rôle des écrits réflexifs dans le processus d’autonomisation des étudiants;Maud Ciekanski,Sophie Bailly,Anne Chateau,Peggy Candas,R. Bary,M. Rees;COUV;;2016;;;;fr
https://hal.univ-lorraine.fr/hal-02365821;SMEs’ Innovation and Export Capabilities: Identification and Characterization of a Common Space Using Data Spatialization;Manon Enjolras,Mauricio Camargo,Christophe Schmitt;ART;10.4067/S0718-27242016000200006;2016;Journal of Technology Management and Innovation;Universidad Alberto Hurtado;;en
https://hal.univ-lorraine.fr/hal-02537778;La paradigme de la complexité pour aborder le lien entre innovation et exportation en PME;Manon Enjolras,Christophe Schmitt,M Camargo;COUV;;2016;;;;fr
https://hal.archives-ouvertes.fr/hal-01332552;Cost and efficiency assessment during deep energy refurbishment strategies: A case-study-based methodology;Lamia Brissel,Laurent Dupont,Laure Morel,Claudine Guidat;ART;;2016;International journal of energy, environment, economics;Nova Science Publishers;;en
https://hal.univ-lorraine.fr/hal-01522499;Biodiesel-TBL plus : A new hierarchical sustainability assessment framework of PC&I for biodiesel production - Part I;Sandra Bautista,P. Narvaez,Mauricio Camargo,Olivier Chery,Laure Morel;ART;10.1016/j.ecolind.2015.06.020;2016;Ecological Indicators;Elsevier;;en
https://hal.univ-lorraine.fr/hal-01959506;Complex Systems Design & Management;Gérard Auvray,Jean-Claude Bocquet,Eric Bonjour,Daniel Krob;DOUV;;2016;;;Sixth International Conference on Complex Systems Design & Management, CSD&M 2015;en
https://hal.univ-lorraine.fr/hal-01960097;Fab Labs : L’usager Innovateur;Laure Morel,Serge Le Roux;DOUV;;2016;;;;fr
https://hal.univ-lorraine.fr/hal-01960316;De la connaissance de soi à la compréhension de l'autre;Raphaël Bary,Martine Tani;COUV;;2016;;;;fr
https://hal.univ-lorraine.fr/hal-01960108;Ingénierie de l’innovation;Vincent Boly,Mauricio Camargo,Laure Morel;DOUV;;2016;;;;fr
https://hal.univ-lorraine.fr/hal-01960303;Démocratisation de la fabrication additive : impression 3D et FabLabs;Hakim Boudaoud,Vincent Boly;COUV;;2016;;;;fr
https://hal.univ-lorraine.fr/hal-01522501;Improving users' product acceptability: an approach based on Bayesian networks and a simulated annealing algorithm;Giovanny Arbelaez Garces,Auguste Rakotondranaivo,Eric Bonjour;ART;10.1080/00207543.2016.1156183;2016;International Journal of Production Research;Taylor & Francis;;en
https://hal.archives-ouvertes.fr/hal-01891121;From descriptive customer data to need definition: a formalised approach;Vincent Boly,Laure Morel,Mauricio Camargo,Helmi Ben Rejeb;ART;10.1504/IJPD.2016.10004476;2016;International Journal of Product Development;Inderscience;;en
https://hal.univ-lorraine.fr/hal-01522693;Improving the idea selection process in creative workshops through contextualisation;Alex Gabriel,Mauricio Camargo,Davy Monticolo,Vincent Boly,Mario Bourgault;ART;10.1016/j.jclepro.2016.05.039;2016;Journal of Cleaner Production;Elsevier;;en
